[
    {
        "id": "business_graph",
        "typedOver": "type_graph.json",
        "nodes": [
            {
                "id": "org_1",
                "type": "Organization",
                "attributes": {
                    "name": "ABC Software Inc."
                }
            },
            {
                "id": "dept_Sales",
                "type": "Sales",
                "attributes": {
                    "name": "Sales"
                }
            },
            {
                "id": "dept_Eng",
                "type": "Engineering",
                "attributes": {
                    "name": "Engineering"
                }
            },
            {
                "id": "dept_IT",
                "type": "IT",
                "attributes": {
                    "name": "IT"
                }
            },
            {
                "id": "dept_HR",
                "type": "HR",
                "attributes": {
                    "name": "HR"
                }
            },
            {
                "id": "user_EMP001",
                "type": "User",
                "attributes": {
                    "name": "Alice"
                }
            },
            {
                "id": "user_EMP002",
                "type": "User",
                "attributes": {
                    "name": "Bob"
                }
            },
            {
                "id": "user_EMP003",
                "type": "User",
                "attributes": {
                    "name": "Charlie"
                }
            },
            {
                "id": "user_EMP004",
                "type": "User",
                "attributes": {
                    "name": "Diana"
                }
            },
            {
                "id": "device_EMP001",
                "type": "Device",
                "attributes": {
                    "deviceType": "laptop",
                    "os": "Windows 10",
                    "accepts_ntlm": true
                }
            },
            {
                "id": "device_EMP002",
                "type": "Device",
                "attributes": {
                    "deviceType": "laptop",
                    "os": "Ubuntu",
                    "accepts_ntlm": false
                }
            },
            {
                "id": "device_EMP003",
                "type": "Device",
                "attributes": {
                    "deviceType": "desktop",
                    "os": "Windows 10",
                    "accepts_ntlm": false
                }
            },
            {
                "id": "device_EMP004",
                "type": "Device",
                "attributes": {
                    "deviceType": "desktop",
                    "os": "Windows 10",
                    "accepts_ntlm": false
                }
            },
            {
                "id": "email_EMP001",
                "type": "EmailAccount",
                "attributes": {
                    "role": "user",
                    "domain": "example.com",
                    "status": "active",
                    "compromised": false
                }
            },
            {
                "id": "email_EMP002",
                "type": "EmailAccount",
                "attributes": {
                    "role": "user",
                    "domain": "example.com",
                    "status": "active",
                    "compromised": false
                }
            },
            {
                "id": "email_EMP003",
                "type": "EmailAccount",
                "attributes": {
                    "role": "admin",
                    "domain": "example.com",
                    "status": "active",
                    "compromised": false
                }
            },
            {
                "id": "email_EMP004",
                "type": "EmailAccount",
                "attributes": {
                    "role": "user",
                    "domain": "example.com",
                    "status": "active",
                    "compromised": false
                }
            },
            {
                "id": "server1",
                "type": "Server",
                "attributes": {
                    "name": "RDP-Server",
                    "os": "Windows Server 2019",
                    "accepts_ntlm": true
                }
            },
            {
                "id": "server2",
                "type": "Server",
                "attributes": {
                    "name": "DB-Server",
                    "os": "Ubuntu 20.04",
                    "accepts_ntlm": false
                }
            },
            {
                "id": "host1",
                "type": "Host",
                "attributes": {
                    "os": "Windows",
                    "compromised": false,
                    "accepts_ntlm": true
                }
            },
            {
                "id": "host2",
                "type": "Host",
                "attributes": {
                    "os": "Ubuntu",
                    "compromised": false,
                    "accepts_ntlm": true
                }
            },
            {
                "id": "rdp_service1",
                "type": "Service",
                "attributes": {
                    "type": "RDP",
                    "exposed": true
                }
            },
            {
                "id": "file1",
                "type": "File",
                "attributes": {
                    "name": "config.sh",
                    "isSensitive": true,
                    "tampered": false
                }
            },
            {
                "id": "file2",
                "type": "File",
                "attributes": {
                    "name": "secrets.txt",
                    "isSensitive": true,
                    "tampered": false
                }
            },
            {
                "id": "cred_EMP001",
                "type": "Credentials",
                "attributes": {
                    "owner": "user_EMP001",
                    "reused": false,
                    "compromised": false
                }
            },
            {
                "id": "cred_EMP002",
                "type": "Credentials",
                "attributes": {
                    "owner": "user_EMP002",
                    "reused": true,
                    "compromised": false
                }
            },
            {
                "id": "hash_EMP003",
                "type": "CredentialHash",
                "attributes": {
                    "owner": "user_EMP003",
                    "stolen": false
                }
            }
        ],
        "edges": [
            {
                "id": "e1",
                "source": "org_1",
                "type": "has_department",
                "target": "dept_Sales"
            },
            {
                "id": "e2",
                "source": "org_1",
                "type": "has_department",
                "target": "dept_Eng"
            },
            {
                "id": "e3",
                "source": "org_1",
                "type": "has_department",
                "target": "dept_IT"
            },
            {
                "id": "e4",
                "source": "org_1",
                "type": "has_department",
                "target": "dept_HR"
            },
            {
                "id": "e5",
                "source": "dept_Sales",
                "type": "employs",
                "target": "user_EMP001"
            },
            {
                "id": "e6",
                "source": "dept_Eng",
                "type": "employs",
                "target": "user_EMP002"
            },
            {
                "id": "e7",
                "source": "dept_IT",
                "type": "employs",
                "target": "user_EMP003"
            },
            {
                "id": "e8",
                "source": "dept_HR",
                "type": "employs",
                "target": "user_EMP004"
            },
            {
                "id": "e9",
                "source": "email_EMP001",
                "type": "uses",
                "target": "device_EMP001"
            },
            {
                "id": "e10",
                "source": "email_EMP002",
                "type": "uses",
                "target": "device_EMP002"
            },
            {
                "id": "e11",
                "source": "email_EMP003",
                "type": "uses",
                "target": "device_EMP003"
            },
            {
                "id": "e12",
                "source": "email_EMP004",
                "type": "uses",
                "target": "device_EMP004"
            },
            {
                "id": "e13",
                "source": "email_EMP003",
                "type": "manages",
                "target": "email_EMP001"
            },
            {
                "id": "e14",
                "source": "email_EMP003",
                "type": "manages",
                "target": "email_EMP002"
            },
            {
                "id": "e15",
                "source": "email_EMP003",
                "type": "manages",
                "target": "email_EMP004"
            },
            {
                "id": "e16",
                "source": "user_EMP001",
                "type": "owns",
                "target": "email_EMP001"
            },
            {
                "id": "e17",
                "source": "user_EMP002",
                "type": "owns",
                "target": "email_EMP002"
            },
            {
                "id": "e18",
                "source": "user_EMP003",
                "type": "owns",
                "target": "email_EMP003"
            },
            {
                "id": "e19",
                "source": "user_EMP004",